text,category,Unnamed: 0,Unnamed: 0.1,Unnamed: 0.1.1,Unnamed: 0.1.1.1,description,category_code
"Здравствуйте, подскажите, как пройти рекапчу на сайте регистрации, если нет галочки и раздела «я не робот». Спасибо.",SiteAndCoins,191.0,90.0,90.0,,здравствуйте подсказать пройти рекаптать сайт регистрация галочка раздел робот» спасибо,0.0
"Добрый день, потерял пароль логин от своего аккаунта онлайн заказа. Пытался заново зарегистрироваться не получилось, пишет что такой человек с таким именем и фамилие и номером мобильного уже зарегистрирован ( ). Не могли бы вы удалить данный аккаунт чтобы я заново зарегистрировался либы же помочь восстановить доступ. Заранее спасибо.  ",SiteAndCoins,192.0,91.0,91.0,,добрый день потерять пароль логин свой аккаунт онлайн заказ пытаться заново зарегистрироваться получиться писать человек такой фамилие номер мобильный зарегистрировать мочь удалить данный аккаунт заново зарегистрироваться помочь восстановить доступ заранее спасибо,0.0
"Добрий день
При виборі регіону відсутня Донецька область. Обласне відділення Ощадбанку знаходиться у м. Краматорськ.",SiteAndCoins,193.0,92.0,92.0,,добрий день вибір регіон відсутній донецький область обласний відділення ощадбанк знаходитися краматорськ,0.0
"Не могу зайти в онлайн кабинет заказа монет, по логину имейл при регистрации, тот с которого пишу, раньше пользовался успешно, так же не получается восстановить пароль, пишет что моего логина не существует, хотя пароль помню, но не могу зайти, почините.

С Уважением",SiteAndCoins,194.0,93.0,93.0,,мочь зайти онлайн кабинет заказ монета логин имейл регистрация который писать ранний пользоваться успешно получаться восстановить пароль писать логин существовать хотя пароль помнить мочь зайти починить уважение,0.0
"Реєструвався на аккаунті НБУ,пройшов усі обов'язкові етапи реєстрування,зареєструвався,при вході в аккаунт пише ""Обліковий запис заблоковано. Для розблокування облікового запису необхідно повідомити технічній підтримці на адресу: support.online@bank.gov.ua наступну інформацію: логін, ПІБ(українською мовою), дату народження, електронну адресу реєстрації(email)"".
Також реєструвався на розкладці української мови,але на сайті постійно висвічувалась графа ""Переведіть клавіатуру на українську мову"".
Інформацію на мою дану почтову скриньку не поступала,та не поступає.",SiteAndCoins,195.0,94.0,94.0,,реєструватися аккаунт пройти увесь обов'язковий етап реєстрування зареєструватися перти вхід аккаунт писати обліковий запис заблокувати розблокування обліковий запис необхідно повідомити технічний підтримка адреса support online bank наступний інформація логін український мова дата народження електронний адреса реєстрація email також реєструватися розкладка український мова сайт постійно висвічуватися граф перевести клавіатура український мова інформація даний почтовий скринька поступати поступати,0.0
"Добрый день. Забыл логин и пароль для он-лайн заказа памятных  монет . Мой телефон 050. Как можно востановить данные для продолжения заказов памятных монет? С уважением, Нв.",SiteAndCoins,196.0,95.0,95.0,,добрый день забыть логин пароль лайна заказ памятный монета телефон востановить дать продолжение заказ памятный монета уважение,0.0
"приходит письмо на почту с ссылкой. но пройдя по ней выдает ошибку. как восстановить пароль？


Надіслано зMeizu M3s",SiteAndCoins,197.0,96.0,96.0,,приходить письмо почта ссылка пройти выдавать ошибка восстановить пароль？ надіслать зmeizu,0.0
Чи можливо видалити акаунт ?,SiteAndCoins,198.0,97.0,97.0,,можливый видалить акаунт,0.0
"Помилка, перевірку я не робот не пройдено. Пише при реєстрації. А перевірки цієї немає на сторінці. Що робити? Регіон Суми",SiteAndCoins,199.0,98.0,98.0,,помилка перевірка робот пройти писати реєстрація перевірка немає сторінка робити регіон сума,0.0
Як пройти ідентифікацію що я не робот?? Такого пункту ніде немає! А я не можу завершити реєстрацію!,SiteAndCoins,200.0,99.0,99.0,,пройти ідентифікація робот такий пункт ніде немає могти завершити реєстрація,0.0
"Доброго дня.
Я намагаюся зареєструватися на сайті  https://bank.gov.ua/.
Після заповнення всіх необхідних даних неможливо завершити реєстрацію, з'являється повідомлення про помилку ""Не пройдено перевірку ""Я не робот"". Відповідну перевірку сайт пройти не пропонує, віконце ""капча"", здається, неактивне. 
Прошу допомоги у реєстрації.",SiteAndCoins,201.0,100.0,100.0,,добрий день намагатися зареєструватися сайт https bank після заповнення весь необхідний даний неможливо завершити реєстрація з'являтися повідомлення помилка пройти перевірка робот відповідний перевірка сайт пройти пропонувати віконце капча здається неактивний просити допомога реєстрація,0.0
"Доброго дня!
За надцятою спробою мені вдалося зареєструваися на сайті .Система повідомила ,що для підтвердження потрібно пройти по посиланню,яке надійшло мені на пошту і що це посилання дійсне одну добу. Проблема в тому що на пошту мені нічого так і не надійшло. Допоможіть з вирішенням даної проблемию.Спасибі.",SiteAndCoins,202.0,101.0,0.0,0.0,добрий день надцятий спроба вдатися зареєструваутися сайт система повідомити підтвердження потрібно пройти посилання який надійти пошта посилання дійсний один доба проблема пошта нічого надійти допомогти вирішення даний проблемити спасибі,0.0
"Доброго дня,

Я зайшла до порталу, однак не змогла перевірити та відредагувати номер телефону, бо не змогла взагалі знай ти картки нашого підприємства. Print Screen нижче.",Hotline,203.0,102.0,1.0,1.0,добрий день зайти портал однак змогти перевірити відредагувати номер телефон змогти взагалі знати картка підприємство print screen нижче,1.0
"Доброго дня.
Прошу Вас надати можливість взяти участь у робочій зустрічі в рамках проекту Спліт з питань складання та подання звітності  НФУ до Національного банку України",Hotline,204.0,103.0,2.0,2.0,добрий день просити надати можливість взяти участь робочий зустріч рамка проект спліт питання складання подання звітність національний банка україна,1.0
"Hello Portal,
 Прошу рассмотреть аналитику корректности справочника KL_D020,
 который размещен в API и в виде excel файла на сайте НБУ.
 О     результатах     рассмотрения    обращения    прошу   уведомить
 обратным  письмом.
  З повагою,",Hotline,205.0,104.0,3.0,3.0,hello portal просить рассмотреть аналитик корректность справочник который разместить excel файл сайт результат рассмотрение обращение просить уведомить обратный письмо повага,1.0
"Добрый день !
Не подскажите телефон отдела,который рассчитывает и выкладывает на сайт НБУ в раздел 
Наглядова статистика_економічні нормативи_економічні нормативи та ліміти відкритоївалютної позиції
Хочу проконсультироваться...
Спасибо !",Hotline,206.0,105.0,4.0,4.0,добрывати день подскажити телефон отдела которывати рассчитывает выкладывает сайт раздло наглядовий статистик економічний норматив економічний норматив ліміт відкритоївалютний позиція хотіти проконсультироватися спасиба,1.0
"Доброго вечора!

Виникло питання стосовно коректності можливих сполучень в довіднику
KOD_07_1 для рахунків 1811, 1819 в частины параметру S083:
відповідно до внутрішніх документів банку, що регламентують порядок оцінки кредитного ризику, Банк оцінює дебіторську заборгованість на індивідуальній основі, що дозволено вимогами Постанови Правління НБУ №
351 (тобто S083 = 1)

В довіднику KOD_07_1 для рахунку 1819/1811 S083 = 2 (при S080 = K, L ) При прийомі файлу 07Х на порталі НБУ помилка:
 Метрика T100=7000000. Неможливе сполучення KOD_07_1 Для аналізу: 
KU=20 EKP=A07F84 T020=1 R020=1819 R011=4 R013=0 S080=K S083=1 S130=90
F037=71 F083=11 FBM=#

Вважаємо, що правила для контролю можливих сполучень потребують уточнення з урахуванням вимог Правління НБУ № 351.


Дякуємо!",Hotline,207.0,106.0,5.0,5.0,добрий вечір виникнути питання стосовно коректність можливий сполучення довідник рахунок частины параметр відповідно внутрішній документ банка регламентувати порядок оцінка кредитний ризик банк оцінювати дебіторський заборгованість індивідуальний основа дозволити вимога постановити правління тобто довідник рахунок перти прийом файл портал помилка метрика неможливий сполучення аналіз вважати правило контроль можливий сполучення потребувати уточнення урахування вимога правління дякувати,1.0
"Добрий день, пришліть будь ласка протокол файлу 07Х
дякую",Hotline,208.0,107.0,6.0,6.0,добрий день прислати бути ласка протокол файл дякувати,1.0
"Здравствуйте, как можно взять информацию о настоящих компаниях МФО. Если можно то пришлите её с ответом на почту .",Hotline,209.0,108.0,7.0,7.0,здравствуйте взять информация настоящий компания прислать ответ почта,1.0
"Добрий день.
При створенні GET запиту про завантаженню інформації щодо проходження контролів за файлами виникає помилка: «{""exception"":""null""}».
При цьому, за запитами авторизації, отримання переліку звітів, переліку файлів, довідників – запити обробляються коректно.
Підкажіть, в чому може бути причина? Можливо, інформація за контролями в режимі API наразі недоступна?
Дякуємо.",Hotline,210.0,109.0,8.0,8.0,добрий день створення запитий завантаження інформація щодо проходження контрол файл виникати помилка exception null запит авторизація отримання перелік звіт перелік файл довідник запит оброблятися коректно підказати чома може бута причина можливо інформація контроляма режим наразі недоступний дякувати,1.0
"Доброго дня,

Потрібна Ваша допомога. Я скачав Додаток ""Монети України""
Інформативно все працює добре. Але для замовлення онлайн потрібно увійти в систему. При скачувані не запитувало про створення логіна і паролю. відповідно увійти не можу. Реєстраційна форма відсутня. Звернутися на підтримку - Обробка запитів громадян також не є можливим так як видає помилку.

Яким Чином можу увійти в систему і повноцінно користуватися додатком?

Дякую за розуміння і сподіваюся на допомогу.",SiteAndCoins,211.0,110.0,9.0,9.0,добрий день потрібний допомога скачати додаток монета україна інформативно працювати добре замовлення онлайн потрібно увійти система скачуваний запитувати створення логін пароль відповідно увійти могти реєстраційний форма відсутній звернутися підтримка обробка запит громадянин також бути можливий видавати помилка яким могти увійти система повноцінно користуватися додаток дякувати розуміння сподіватися допомога,0.0
Добрый день.пришло подтверждение о регистрации на почту.перешол по сылке и выбило ошибку.что делать?,SiteAndCoins,212.0,111.0,10.0,10.0,добрый день прийти подтверждение регистрация почта перешол сылка выбить ошибка делать,0.0
"Не можливо зарєгеструватися, пише невірний логін,",SiteAndCoins,213.0,112.0,11.0,11.0,можливо зарєгеструватися писати невірний логін,0.0
Забув старий пароль. Прошу надати новий ,SiteAndCoins,214.0,113.0,12.0,12.0,забути старий пароль просити надати новий,0.0
"Добрый день подскажите как пройти проверку, что я не робот",SiteAndCoins,215.0,114.0,13.0,13.0,добрый день подсказать пройти проверка робот,0.0
"Добрый день! Я заказал набор монет в г Черновцы, можно его отправить сразу в г Полтава.
Спасибо.",SiteAndCoins,216.0,115.0,14.0,14.0,добрый день заказать набор монета черновцы отправить сразу полтава спасибо,0.0
"Ще раз добрий день, Адміністраторе.

Мене звати , браузер - Chrome, операціяйна система - Mac OC, роутер - TPLINK WR940N.
Я точно не робот - чому я бачу це повідомлення після того як ввів кількість монет і натиснув підтвердити?
При цьому браузер на якийсь час наче підвисає.

З повагою,",SiteAndCoins,217.0,116.0,15.0,15.0,добрий день адміністратор звати браузер chrome операціяйний система роутерти tplink точно робот чома бачити повідомлення після ввести кількість монета натиснути підтвердити браузер якийсь наче підвисати повага,0.0
"Доброго ранку, забула логін до кабінету. Допоможіть відновити доступ. ",SiteAndCoins,218.0,117.0,16.0,16.0,добрий ранка забути логін кабінет допомогти відновити доступ,0.0
"Доброго дня, не можливо зареестувати користувача, пише що користувач з такими данними вже є у стистемі, але ця людина ніразу не рееструвалась.
Що робити якщо наприклад реально існує 2 людини з одинаковим ПІП і датою народження?",SiteAndCoins,219.0,118.0,17.0,17.0,добрий день можливо зареестуват користувач писати користувач такий данний бути стистема людина ніраз рееструватися робити якщо наприклад реально існувати людина одинаковий дата народження,0.0
"Добрый день, просьба разблокировать учётную запись.",SiteAndCoins,220.0,119.0,18.0,18.0,добрый день просьба разблокировать учётный запись,0.0
"Не можливо зарєгеструватися, пише невірний логін, , логін ",SiteAndCoins,221.0,120.0,19.0,19.0,можливо зарєгеструватися писати невірний логін логін,0.0
"Я проходил регистрацию, но пишет не прошло, вункцию я не робот

Отправлено с моего устройства Huawei",SiteAndCoins,222.0,121.0,20.0,20.0,проходить регистрация писать пройти вункция робот отправить устройство huawei,0.0
"Доброго дня, не можу зареєструватися. Пише що такого логічну не існує. ",SiteAndCoins,223.0,122.0,21.0,21.0,добрий день могти зареєструватися писати такий логічний існувати,0.0
Добрый день.Как пройти регистрацию и заказать монеты? Регистрацию невозможно пройти.,SiteAndCoins,224.0,123.0,22.0,22.0,добрый день пройти регистрация заказать монета регистрация невозможно пройти,0.0
"Не можу   заєструватись на сайті, там де дата народження пише помилку, пробувала вже більше 7 разів, ніяк не виходить, все решта інформація коректна, дякую за відповідь.",SiteAndCoins,225.0,124.0,23.0,23.0,могти заєструватися сайт дата народження писати помилка пробувалий більше ніяк виходити решта інформація коректний дякувати відповідь,0.0
"Здравствуйте. Загрузил мобильную версию и пытался зарегистрироваться. Постоянно пишет, что я не прошел процедуру проверки «Я не робот». В пояснении пишет, что она автоматически происходит, но мне ничего не выскакивает. Подумал, проблему в моб. версии. Зашел на сайт с ноутбука, и почему-то все поля по-английски. Почему в моб. версии на украинском языке просит ФИО писать, а на сайте латинскими буквами? 
Из-за чего может быть сбой регистрации? ",SiteAndCoins,226.0,125.0,24.0,24.0,здравствуйте загрузить мобильный версия пытаться зарегистрироваться постоянно писать пройти процедура проверка робот» пояснение писать автоматически происходить выскакивать подумать проблема версия зайти сайт ноутбук почему поле английски почему версия украинский язык просить писать сайт латинский буква сбой регистрация,0.0
Не можу відновити пароль,SiteAndCoins,227.0,126.0,25.0,25.0,могти відновити пароль,0.0
