text,category,Unnamed: 0,Unnamed: 0.1,Unnamed: 0.1.1,Unnamed: 0.1.1.1,description,category_code
"
Поменял паспорт-книжечку на ID карту, сам принес его в банк для обновления данных. В банке хотят видеть выписку о месте регистрации, ссылаются что это требует НБУ. Но зачем же наговаривать на НБУ, если служба поддержки говорит что это только внутренняя инструкция банка. Вопросы к представителям банка. Я не менял места жительства, зачем банку эта информация? Как справляются другие банки, которые выписку не требуют, они нагло нарушают требования НБУ?)
",Positive,384.0,283.0,182.0,81.0,поменять паспорт книжечка карта принести банк обновление дать банк хотеть видеть выписка место регистрация ссылаться требовать наговаривать служба поддержка говорить внутренний инструкция банк вопрос представитель банк менять место жительство банк этот информация справляться другой банк который выписка требовать нагло нарушать требование,2.0
"
Хочу поділитися досвідом отримання карти Pudra від Таскомбанку. Нижче звернення до них: 

Я є клієнтом Вашого банку вже не перший рік. Користуюсь кредитно картою Велика П'ятірка, та маю декілька відкритих депозитів. Почитав на сайті про кредитну карту Pudra. Зацікавив цей продукт хорошим набором підвищеного кеш-беку на досить потрібні категорії, але коли почав конкретніше взнавати про умови, то з'ясувалось, що я її отримати не зможу, тому що, бачите, стать в мене не та. Це що за неподобство? На лице відверта та неприхована дискримінація за ознакою статі і відповідно порушення Закону України про забезпечення рівних прав та можливостей жінок і чоловіків. Це ж готовий судовий позов. Якщо Ви вже зробили щось таке для жінок, то зробіть і аналог для чоловіків зі схожим набором (велика п'ятірка не рахується, оскільки її можуть отримати всі і там немає тих категорій з таким кеш-беком як в пудрі). Можливо це когось здивує, але мені так само потрібні ліки, шампунь, мило, дезодорант, одеколон, взуття та одяг. А ще краще зробіть велику п'ятірку дійсно ВЕЛИКОЮ — об'єднайте можливості обох карт в одну і буде всім щастя!
P.S. А поки будете розмірковувати як зробити краще, дайте добро на отримання Пудри всім охочим.

Банк відреагував досить швидко. Через два дні прийшла відповідь з варіантом вирішення проблеми. Запропонували оформити не іменну карту Pudra як додаткову до власної кредитки Велика п'ятірка. Тобто один кредитний ліміт на дві карти. 
Тепер з двома картами в мене кешбек: Супермаркети, АЗС — 2%, одяг та взуття — 5%, аптеки, косметика, і якесь б’юті – 3%, будь-які інші транзакції, в тому числі онлайн (поповнення мобільного, оплата інтернет…) — 1%. Причому всі відсотки вказані «чистими», тобто вже після сплати усіх податків. Єдиний недолік, якщо це так можна назвати, за додаткову карту доведеться заплатити 200 грн. Це дещо порушило мій принцип безкомісійності, але…
",Positive,385.0,284.0,183.0,82.0,хотіти поділитися досвід отримання карта pudra таскомбанк нижче звернення вони бути клієнт банка перший ріка користуватися кредитно карта великий п'ятірка мати декілька відкритий депозит почитати сайт кредитний карта pudra зацікавити продукт хороший набір підвищений досить потрібний категорія коли почати конкретніше взнавати умова з'ясуватися отримати змогти бачити стати неподобство лице відвертий неприхований дискримінація ознака стать відповідно порушення закон україна забезпечення рівний право можливість жінка чоловік готовий судовий позов якщо зробити щось такий жінка зробити аналог чоловік схожий набір великий п'ятірка рахуватися оскільки могти отримати весь немає категорія такий пудра можливо хтось здивувати потрібний ліки шампунь мило дезодорант одеколон взуття одяг краще зробити великий п'ятірка дійсно великий об'єднати можливість обоє карта один бути весь щастя поки бути розмірковувати зробити краще дати добра отримання пудра весь охочий банк відреагувати досить швидко прийти відповідь варіант вирішення проблема запропонувати оформити іменний карта pudra додатковий власний кредитка великий п'ятірка тобто кредитний ліміт карта тепер карта кешбек супермаркет одяг взуття аптека косметика якийсь б’ют бути який інший транзакція число онлайн поповнення мобільний оплата інтернет… причому весь відсоток вказаний «чистими» тобто після сплатити увесь податок єдиний недолік якщо можна назвати додатковий карта довестися заплатити дещо порушити принцип безкомісійність але…,2.0
"Мое предприятие обслуживается в Киевском отделении № 33. Очень довольны! Каждый раз, когда обращаемся, любой вопрос решается оперативно, профессионально и с любовью! Приходится обращаться и в другие банки − чувствуется разница именно в отношении персонала к нам, клиентам. Радует также клиент-банк и ПУМБ всегда на высоте! Хочу выразить признательность за такую классную работу управляющей Ирине и Елене Полосенко. Удачи и процветания отделению. Будем рекомендовать вас друзьям!",Positive,386.0,285.0,184.0,83.0,предприятие обслуживаться киевский отделение очень довольный каждый обращаться любой вопрос решаться оперативно профессионально любовь приходиться обращаться другой банк чувствоваться разница именно отношение персонал клиент радовать также клиент банк пумба высота хотеть выразить признательность такой классный работа управлять ирина елена полосенко удача процветание отделение быть рекомендовать друг,2.0
"
 Кредобанк оновив сайт, але тепер всі старі посилання з google ведуть на головну сторінку нового сайту.
",Positive,387.0,286.0,185.0,84.0,кредобанк оновити сайт тепер весь старий посилання google вести головний сторінка новий сайт,2.0
"
Пользуюсь с самого начала, ещё ни разу не возникало трудностей с какими либо сервисами данного банка.
",Positive,388.0,287.0,186.0,85.0,пользоваться самый начало возникать трудность какой либо сервис данный банк,2.0
"
Хочу отметить сотрудника Светлану, которая отвечала мне сегодня в 22-20 / 22-50 по ситуации повторного списания средств от Альфа банка. Сотрудник прекрасно понимает свои задачи и в сложной ситуации умеет найти правильный подход к клиенту и поднять ему настроение. Большое спасибо Светлане! Надеюсь руководство ценит таких сотрудников
",Positive,389.0,288.0,187.0,86.0,хотеть отметить сотрудник светлана который отвечать сегодня ситуация повторный списание средство альфа банк сотрудник прекрасно понимать свой задача сложный ситуация уметь найти правильный подход клиент поднять настроение большой спасибо светлана надеяться руководство ценить такой сотрудник,2.0
"
26.12.19. був у регіональному відділенні банку. Не бозна яка подія аби писати про це, але до мене зателефонували з головного офісу фінустанови щоб почути мою оцінку про роботу місцевого персоналу. Оскільки я був у дорозі, то з об’єктивних причин не зміг висловитись з цього приводу. А зараз є можливість залишити допис і це варто зробити – спробую пояснити чому. Проживаю на межі двох областей і добираюся до найближчого «ПУМБу» в сусідню область за 30 км (їхав з метою внесення коштів на рахунок і вирішення низки поточних поза фінансових справ). Зайшовши в приміщення, вирішив оминути банківський термінал – у мене були купюри «дрібного» номіналу, – відтак попрямував до каси, а вона ще не працює… За 1,5-2 години повернувся до відділення і потрапив на технічну перерву… А коли втретє за сьогоднішній день опинився біля касового віконечка, то почув повідомлення: «Прохання чергу не займати – обідня перерва»! «Отакої, а як же я?», – вилетіло з мене здивування. А далі було як у казці: чарівна фея в особі керуючої відділенням банку, вислухавши мої поневіряння, провела електронне зарахування коштів зі свого «компа», а затим проконтролювала їхнє фізичне «переміщення» – за що їй велика вдячність. Отож, я виграв у часі та й зрозумів, що дива трапляються, і саме на Різдво!!! Насамкінець дякую також іншим працівникам цього відділення (економістам, касиру) і щиро вітаю усіх словами Я. Соколової: «З Різдвом католики, протестанти і частина православних!»
",Positive,390.0,289.0,188.0,87.0,бути регіональний відділення банка бозна який подія писати зателефонувати головний офіс фінустанова почути оцінка робот місцевий персонал оскільки бути дорога об’єктивний причина змогти висловитися привод зараза бути можливість залишити допис варта зробити спробувати пояснити чома проживати межа область добиратися найближчий «пумбу» сусідній область їхати мета внесення кошт рахунок вирішення низка поточний поза фінансовий справити зайшовши приміщення вирішити оминути банківський термінал бути купюра «дрібного» номінал відтак попрямувати каса вона працює… година повернутися відділення потрапити технічний перерву… коли втретє сьогоднішній день опинитися біля касовий віконечко почути повідомлення «прохання черга займати обідня перерва» «отакий вилетіти здивування далі бути казка чарівний особа керуючий відділення банка вислухавши поневіряння провести електронний зарахування кошт свій «компа» затим проконтролювати їхній фізичний «переміщення» вона великий вдячність отож виграти зрозуміти диво траплятися саме різдво насамкінець дякувати також інший працівник відділення економіст касир щиро вітати увесь слово соколів різдво католик протестант частина православний,2.0
"
10 марта 2020 г.обратился в отделение по вопросу, который не смогла решить персональный менеджер Ольга Евграфова и нач.отд.Ольга Хоменко в отд.4 на Хрещатике. Благодаря профессионализму персонального менеджера Тесленко Ирины, оформил все документы для решения вопроса, и получил развернутые ответы на вопросы, которые задавл сотрудникам и начальнику отд.4. Респект Ирине из 13 отд., мягко говоря… дизайлк двум Ольгам на Хрешатике отд 4. за работу.
",Positive,391.0,290.0,189.0,88.0,март обратиться отделение вопрос который смочь решить персональный менеджер ольга евграфов ольга хоменко хрещатик благодаря профессионализм персональный менеджер тесленко ирина оформить документ решение вопрос получить развернуть ответ вопрос который задавть сотрудник начальник респект ирина мягко говоря… дизайлк ольга хрешатик работа,2.0
"
Я, Махно Евгенія, являюсь клієнтом банку з грудня 2019 року. У мене склалося дуже позитивне враження від обслуговування працівниками банку. Співробітники банку завжди ввічливі, компетентно відповідають на питання. Я відвідую банк під час своєї обідньої перерви, касири швидко мене обслуговують. Хочу відзначити касирів Гирич Оксану, Мозгову Вероніку, які уважно відносяться до клієнтів, професійно виконують свої обов'язки. Взагалі всі співробітники банку мають високий професійний рівень. Особисто мені дуже приємно обслуговуватися в цьому відділенні. Дякую всім працівникам.
",Positive,392.0,291.0,190.0,89.0,махно евгеній являтися клієнт банка грудень скластися дуже позитивний враження обслуговування працівник банка співробітник банка завжди ввічливий компетентно відповідати питання відвідувати банк свій обідній перерва касир швидко обслуговувати хотіти відзначити касир гирич оксана мозгова вероніка який уважно відноситися клієнт професійно виконувати свій обов'язок взагалі весь співробітник банка мати високий професійний рівень особисто дуже приємно обслуговуватися відділення дякувати весь працівник,2.0
"
Кто бы что ни говорил, но Альфа-Банк реально один из самых нормальных банков. Да, проблемы бывают, очереди еще никто не отменял. Правда это в основном происходит в «час пик» когда люди после работы идут свои дела решать. Недавно заказал новую карту у них. Системы mastercard золотую. По обслуживанию меня все устроило, сотрудник все по полочкам разложил, какие привилегии и услуги есть по карте. Оформили, сделали быстро.
",Positive,393.0,292.0,191.0,90.0,говорить альфа банк реально самый нормальный банк проблема бывать очередь никто отменять правда основное происходить «час пик» человек работа идти свой дело решать недавно заказать новый карта система mastercard золотой обслуживание устроить сотрудник полочка разложить какой привилегия услуга карта оформить сделать быстро,2.0
"
Дуже дякую дівчині, яка відкривала карту, та допомогла мені в деяких нюансах. Все чітко і ввічливо пояснила, розповіла та дала кілька порад. Свою роботу зробила швидко і якісно.
Відділення банку у місті Умань, вул. Тищика 25.
",Positive,394.0,293.0,192.0,91.0,дуже дякувати дівчина який відкривати карта допомогти деякий нюанс чітко ввічливо пояснити розповісти дати кілька порада робот зробити швидко якісно відділення банка місто умань тищик,2.0
"
В банкоматах ТАСКОМБАНКА видають готівку з карток інших банків більше 1000гр.за раз. В інших банках такого нема.
",Positive,395.0,294.0,193.0,92.0,банкомат таскомбанка видавати готівка картка інший банк більше інший банка такий нема,2.0
"
Вже сутки не можу активувати карту в додатку. Завжди пише, що мій запит обробляється і більше нічого не можу зробити.
",Positive,396.0,295.0,194.0,93.0,сутка могти активувати карта додаток завжди писати запит оброблятися більше нічого могти зробити,2.0
"
Добрый день. Меня зовут Кучеренко-Язаджи Татьяна Георгиевна. 
Хочу поблагодарить сотрудника ИКЦ «Эмблема» Жилу Оксану Витальевну в городе Черноморск, Одесская область за прекрасное обслуживание.
Я СПД и время от времени пользуюсь услугами Альфа-банка. 
Всем рекомендую лучшего специалиста по адресу проспект Мира 24/39 Н Жилу Оксану.
Большое СПАСИБО за ваше внимание и профессионализм.
",Positive,397.0,296.0,195.0,94.0,добрый день звать кучеренко язаджи татьяна георгиевич хотеть поблагодарить сотрудник «эмблема» жила оксана виталиевич город черноморск одесский область прекрасный обслуживание время время пользоваться услуга альфа банк весь рекомендовать хороший специалист адрес проспект жила оксана большой спасибо внимание профессионализм,2.0
