text,category,Unnamed: 0,Unnamed: 0.1,Unnamed: 0.1.1,Unnamed: 0.1.1.1,description,category_code
"
На сколько уважаю Дмитрия Александровича и Олега Владимировича, о создании такого крутого банка, кучи их фишек, хотел и писал положительные отзывы… НО… сейчас это предел уже негатива. Обьясню почему:
1.
пт, 21 февр., 09:45 (12 дней назад)
Финмониторинг приостановил крупную сумму, ссылаясь на закон о проверке. Окей, не вопрос, данные по средствам все предоставил — т.е постоянно что то МОниторинг не устраивало, и я дополнял документами как отправителя, так и своими, за что и как я получаю деньги. Прикрепил то что Отправитель расторг депозит и прислал мне денежные средства, с обьяснениями за что и т.п Так же прикреплен паспорт что Отправитель и есть Отправитель, а не левый кто то отправил.
Ежедневно присылали ответ стандартный — Тимофей, ускорили данный вопрос на своей стороне. Дополнительно уведомим вас в обратном письме.

2. Итак......04.03.2020 — ответ до сих пор пишут ( наверное что то такое сочиняют что не могу представить себе).
В поддержке при общении через Вайбер — отвечают быстро и ТОЛЬКО рекомендуют все вопросы решать в письменном виде, коммуникация по данному вопросу происходит исключительно через почту, ответ и обработка в течении суток!!! Прошло 13 дней…
НООО, опять же, после «ускорения» с их стороны 02.03.2020, прошло 2 дня а на письма уже даже и не отвечают (то хоть раз в сутки отвечали).

«Банк вышел за рамки дозволенных требований. По запросу о происхождении и источнике средств, вся информация была предоставлена. Банк запросил дополнительную информацию по не имеющим отношения к данному зачислению транзакциям. Несмотря на то что это не относится к актуальному вопросу, данные по запросу я предоставил. Видно, банк от неожиданности впал в «ступор» и шестой день не даёт вообще никакой ответ, кроме «ожидайте, обрабатываем» хотя обрабатывать там нужно всего 10 маленьких скриншотов+двухминутное видео.

Итог: Банк вышел за рамки допустимого, максимально затягивает решение вопроса на своей стороне, запрашивает информацию не имеющую отношения к замороженному зачислению а получив ВСЕ подтверждения, просто ушёл в «Игнор» на шесть дней.
",Negative,490.0,389.0,288.0,187.0,сколько уважать дмитрий александрович олег владимирович создание такой крутой банк куча фишка хотеть писать положительный отзывы… предел негатив обьяснить почему фёвр день назад финмониторинг приостановить крупный сумма ссылаться закон проверка окей вопрос дать средство предоставить быть постоянно мониторинг устраивать дополнять документ отправитель свой получать деньга прикрепить отправитель расторгнуть депозит прислать денежный средство обьяснения прикрепить паспорт отправитель отправитель левый отправить ежедневно присылать ответ стандартный тимофей ускорить данный вопрос свой сторона дополнительно уведомить обратный письмо итак ответ пора писать наверное такой сочинять мочь представить себя поддержка общение вайбер отвечать быстро рекомендовать вопрос решать письменный коммуникация дать вопрос происходить исключительно почта ответ обработка течение сутки пройти дней… нооо «ускорения» сторона пройти день письмо отвечать сутки отвечать «банк выйти рамка дозволить требование запрос происхождение источник средство весь информация предоставить банк запросить дополнительный информация иметь отношение дать зачисление транзакция несмотря относиться актуальный вопрос дать запрос предоставить видно банк неожиданность впасть «ступор» шестой день давать вообще никакой ответ кроме «ожидать обрабатываем» хотя обрабатывать нужно маленький скриншот двухминутный видео итог банк выйти рамка допустимый максимально затягивать решение вопрос свой сторона запрашивать информация иметь отношение заморозить зачисление получить подтверждение просто уйти «игнор» шесть день,3.0
"
В мене існує борг перед А-Банком, з представниками банку вже домовилися о нових умовах, але компанія DebtFort (яка «допомагає» банку з боргами) продовжує телефонувати в незручний час, турбуть в незручний час, погрожують та в цілому по хамськи звертаються до клієнтів. Зверніть будь ласка увагу на те, до кого ви звертаєтесь та чи мають вони право псувати настрій людям та взагалі відвертають бажання звертатись по допомогу для врегулювання питань.
",Negative,491.0,390.0,289.0,188.0,існувати борг банк представник банка домовитися новий умова компанія debtfort який «допомагає» банка борг продовжувати телефонувати незручний турбути незручний погрожувати цілий хамськи звертатися клієнт звернути бути ласка увага звертатися мати вони право псувати настрій люди взагалі відвертати бажання звертатися допомога врегулювання питання,3.0
"
Ситуация такова, делал перевод денег с зарубежной карты друга (по его согласию) на свою карту, сама перевода 300грн.Дата перевода 7.03.20. После транзакции получил письмо от службы мониторинга моно банка о том что ваша карта заблокирована из за транзакции котора была проведена выше.Обьяснил ситуацию как она есть, сказали чтобы друг подтвердил свою личность, потом сказали ждать ответа от банка емитента, жду, уже 8 день на карте было 2500 которые сейчас по моему мнению незаконно удерживаются.Подзвонил в поддержку сказали написать в письме о том, что я отказываюсь от денег которые поступили мне на счёт и прошу их вернуть назад в банк, в ответ получил «Добрий день. Для вирішення питання необхідно дочекатись відповіді від банку-емітента. Як тільки ми її отримаємо — повідомимо вас у зворотному листі.».Сколько ещё ждать месяць год??? Можно ли как то вернуть деньги?
",Negative,492.0,391.0,290.0,189.0,ситуация таков делать перевод деньга зарубежный карта друг согласие карта перевод дата перевод транзакция получить письмо служба мониторинг моно банк карта заблокировать транзакция котор провести выше обьяснил ситуация есть сказать друг подтвердить личность сказать ждать ответ банк емитент ждать день карта который мнение незаконно удерживаться подзвонить поддержка сказать написать письмо отказываться деньга который поступить счёт просить вернуть назад банк ответ получить «добрий день вирішенний питанний необхідно дочекатиться відповіді банк емітент тілька отримаємый повідомить зворотный листі сколько ждать месяць вернуть деньга,3.0
"
После переписки в вайбере о покупке товара (памперсы) доверилась и оплатила все наперед. (Сумма небольшая 280грн). Товар так и не был отправлен. Точнее позже был скинут номер накладной, которая не существует. Объявление на ОЛХ так и осталось, добавилось новое ещё. Пишу, может это кому то поможет не сделать такую глупость, как я. Вот номер карты мошенника 5375 4141 0978 7100 и телефон 093 158 90 32
",Negative,493.0,392.0,291.0,190.0,переписка вайбер покупка товар памперс довериться оплатить наперёд сумма небольшой товар отправить точнее поздний скинуть номер накладный который существовать объявление остаться добавиться новый писать помочь сделать такой глупость номер карта мошенник телефон,3.0
"
Имею 2 открытых депозита, 2 месяца пробовал повысить кредитный лимит с 0 — отказано. Понятно что ваша оценка клиента туфта. Поддержка отписывается на почту и в ТГ текстами под копирку. Сомнительная и ненадежная банка, буду отговаривать знакомых не пользоваться этой мусорной прогой типа без отделений и закрывать карты
",Negative,494.0,393.0,292.0,191.0,иметь открытый депозит месяц пробовать повысить кредитный лимит отказать понятно оценка клиент туфта поддержка отписываться почта текст копирка сомнительный ненадёжный банк быть отговаривать знакомый пользоваться мусорный прога отделение закрывать карта,3.0
"
мои деньги месяц уже заблокированны. по непонятным причинам я все предоставил у них то выходные то не операционное время кароче полный трэш!!! помогите забрать мое лаве!!!
",Negative,495.0,394.0,293.0,192.0,деньга месяц заблокированный непонятный причина предоставить выходной операционный время кароч полный трэш помочь забрать лава,3.0
"
При заміні картки, без моєї згоди підключили страхівку. Знімає 20грн щомісяця. Коли прийшов, щоб відключили, то сказали, що інтернет у них поганий, а потім сказали, що відключать через 3 місяці. Але коли відкриваєш у них депозит, то інтернет чомусь чудово працює :-).
",Negative,496.0,395.0,294.0,193.0,заміна картка згода підключити страхівко знімати щомісяця коли прийти відключити сказати інтернет поганий потім сказати відключати місяць коли відкривати депозит інтернет чомусь чудово працювати,3.0
"
Доброго дня.
Моя мати ФОП, в неї відкрито рахунок в Альфа-Банку з 2019 року. Наприкінці 2019 року зателефонував працівник банку і повідомив, що рахунок заблоковано виконавчою службою. Виконавча служба повідомила, що блокування рахунку через ДПІ. В ДПІ виявили, що два рази нарахували один і той самий податок і що боргу зі сплати податків нема. ДПІ надала виконавчий службі лист для скасування виконавчого провадження. Виконавча служба, в свою чергу, відправила в лютому лист на головний офіс Альфа-банку з вимогою розблокувати рахунок ФОПа.
З того часу вже пройшов майже місяць. Гаряча лінія Альфа-банку направляє мене до менеджера відділення, менеджер відділення вже котрий раз говорить, що нічого не знає і вияснить пізніше. В ФОПа «заморожені» кошти порядка 8300 грн. Кожен день «простою» приносить збитки ФОПу, оскільки через блокування рахунку прийшлось позичити гроші під %.
Нічто нічого не знає, ніяких контактів ніхто не дає. Вимогу виконавчої служби банк ігнорує.

В онлайн сервісі «Ок, Альфа!» бачу взагалі цікаву ситуацію: залишок на рахунку нуль грн.!!! На початку березня списано два рази по 100 грн. за обслуговування рахунку, хоча руху коштів в лютому і березні не було, і не повинні були списувати ці кошти.

Оттакий лохотрон і ігнорування законів від Альфа-Банку.
Будьте обачними з даним банком.

З повагою Вячеслав
",Negative,497.0,396.0,295.0,194.0,добрий день мата вона відкрито рахунок альфа банка наприкінці зателефонувати працівник банка повідомити рахунок заблокувати виконавчий служба виконавчий служба повідомити блокування рахунок виявити нарахувати самий податок борг сплатити податок нема надати виконавчий служба лист скасування виконавчий провадження виконавчий служба черга відправити лютий лист головний офіс альфа банка вимога розблокувати рахунок пройти майже місяць гарячий лінія альфа банка направляти менеджер відділення менеджер відділення котрий говорити нічого знати вияснити пізніше «заморожені» кошт порядок кожний день «простою» приносити збиток оскільки блокування рахунок прийтися позичити гріш нічта нічого знати ніякий контакт ніхто давати вимога виконавчий служба банк ігнорувати онлайн сервіс альфа бачити взагалі цікавий ситуація залишок рахунок нуль початок березень списати обслуговування рахунок хоча кошт лютий березний повинний бути списувати кошт оттакий лохотрон ігнорування закон альфа банка бути обачний даний банк повага вячеслав,3.0
"
обращаюсь с ЖАЛОБОЙ, МОНОБАНК! КИЕВА!
сегодня 29.02.2020 года!!!
ПЛАТИНУМ попрошу заметить, карта, 250 грн в мес.обслуживание, ну это ладно
НО когда списываются деньги просто так, куда-то неизвестно куда, ни уведомления, ни подтверждения… ничего! 
Я зная что деньги на карте. ты на них планируешь какой-то бюджет, свои траты. а когда приходит время оплаты — то там видишь картину не очень., списания за какие-то « операции квази-наличные» или «start sochi» о которых по сегодняшний день я незнала эти названия,, карту не передавала никому, не подписана ни на приложения, ни подписки.
чисто пополняю карту и через нее происходит иногда расчет за кв, или пополнения счета, или сходить в кафе или продукты купить все!!!
позвонив оператору сразу, мне сказали звонить в 102. Ок, написала заявление в полицию. в банке вопрос не решается! как это без ведома вообще происходят транзакции мне не понять! и банк не видит на что потрачены, куда и кем… просто видят сумму. очень крайне разочарована оставив без денег клиента. ПЛатинум только название, а толку ноль… отношение ужасное. я говорю оператору о проблеме с помощью ее решить — а мне рассказывают за привилегии карты… вы серьезно??? и говорят что у меня должен быть постоянно включен мобильный интернет!!! (т.к это онлайн банкинг, и уведомления приходят в приложении монобанк!) ок… это хорошо, НО если нет возможности зайти в ИНТЕРНЕТ!!! забыла пополнить счет мобильный, в конце концов или не хочу его пополнять..!!! это вообще как? желание пропало обслуживаться в этом банке. мне заблокировали карты. и предлагают еще перевыпустить за 150 грн. издевательство!!!
что делать дальше.....??? НЕИЗВЕСТНО!!!
",Negative,498.0,397.0,296.0,195.0,обращаться жалоба монобанк киев сегодня платинум попросить заметить карта обслуживание ладный списываться деньга просто куда неизвестно куда уведомление подтверждения… ничто знать деньга карта планировать какой бюджет свой трата приходить время оплата видеть картина очень списание какой операция квази наличные» «start sochi» который сегодняшний день незнать название карта передавать никто подписать приложение подписка чисто пополнять карта происходить расчёт пополнение счёт сходить кафе продукт купить позвонить оператор сразу сказать звонить около написать заявление полиция банк вопрос решаться ведомо вообще происходить транзакция понять банк видеть потратить кем… просто видеть сумма очень крайне разочаровать оставить деньга клиент платинум название толк ноль… отношение ужасный говорить оператор проблема помощь решить рассказывать привилегия карты… серьёзно говорить должный постоянно включить мобильный интернет онлайн банкинг уведомление приходить приложение монобанк хорошо возможность зайти интернет забыть пополнить счёт мобильный конец конец хотеть пополнять вообще желание пропасть обслуживаться банк заблокировать карта предлагать перевыпустить издевательство делать далёкий неизвестно,3.0
